{
  "$schema": "https://json-schema.org/draft/2020-12/schema",
  "$id": "https://raw.githubusercontent.com/abd-ulbasit/upgradescope/main/api/report.schema.json",
  "title": "upgradescope JSON report, schemaVersion 1",
  "description": "What `upgradescope scan --output json` and `--write-baseline` write. Within schemaVersion 1 fields are only added, never renamed, removed, retyped or given a new meaning, so the schema allows unknown fields: ignore them. Finding categories may be added too, so `category` is an open string; severity, verdict and baselineState values are fixed. internal/cli/docs_test.go validates real scan output against this file and fails on a field it does not list.",
  "type": "object",
  "required": ["schemaVersion", "toolVersion", "clusterId", "target", "kbVersion", "score", "ready", "verdict", "findings"],
  "properties": {
    "schemaVersion": {"const": 1},
    "toolVersion": {"description": "The binary that wrote the report. Informational, no compatibility meaning.", "type": "string"},
    "filesBase": {"description": "--files only: the scanned directory, which object file paths are relative to. Slash-separated and relative to the working directory when it is inside it (\"\" = the working directory), absolute otherwise.", "type": "string"},
    "clusterId": {"description": "The kube-system namespace UID, or \"files\" for a --files scan.", "type": "string"},
    "target": {"$ref": "#/$defs/minor"},
    "serverVersion": {"description": "Live scans: the kube-apiserver's raw gitVersion (e.g. v1.34.2-gke.100), the version the target was judged against. Absent in --files mode.", "type": "string"},
    "kubeContext": {"description": "Live scans: the kubeconfig context the scan read. Absent in --files mode.", "type": "string"},
    "apiServer": {"description": "Live scans: the API server the scan read, as scheme, host and port (e.g. https://10.0.0.1:6443); never the kubeconfig's credentials, path or query. Absent in --files mode.", "type": "string"},
    "kbVersion": {"description": "The knowledge base the report was judged with.", "type": "string"},
    "score": {"description": "max(0, 100 - min(75, 25 x blockers) - min(20, 5 x warnings)); suppressed findings excluded.", "type": "integer", "minimum": 0, "maximum": 100},
    "ready": {"description": "verdict == ready. Kept for v0.1 readers; prefer verdict.", "type": "boolean"},
    "verdict": {"description": "blocked: a blocker. unknown: no blocker, but a required check was not assessed. ready: neither.", "enum": ["ready", "blocked", "unknown"]},
    "findings": {"type": "array", "items": {"$ref": "#/$defs/finding"}},
    "notAssessed": {"type": "array", "items": {"$ref": "#/$defs/gap"}},
    "suppressed": {"type": "array", "items": {"$ref": "#/$defs/suppressed"}},
    "unrecognizedImages": {"description": "Image repositories (host/path, no tag) that no add-on image matcher recognised: a gap in add-on detection, not a finding, so they change neither score nor verdict. An add-on running one is still found through its pod labels, IngressClass or Helm release. Sorted, deduplicated, at most 200.", "type": "array", "maxItems": 200, "items": {"type": "string"}},
    "unrecognizedImagesOmitted": {"description": "Unrecognized image repositories beyond the 200 listed.", "type": "integer", "minimum": 1},
    "hops": {"description": "scan --plan only: the upgrade plan, one entry per control-plane upgrade from the cluster's minor (a live scan's oldest kube-apiserver, or --from) to target, in order. Each finding is listed in full at the first hop that has it and referenced by key at later ones. The rest of the report, the verdict included, is the final target's.", "type": "array", "items": {"$ref": "#/$defs/hop"}},
    "teams": {
      "description": "Per-team scores; findings with no team are under \"unattributed\". Present when there are findings.",
      "type": "object",
      "additionalProperties": {"$ref": "#/$defs/teamScore"}
    }
  },
  "$defs": {
    "minor": {"type": "string", "pattern": "^[0-9]+\\.[0-9]+$"},
    "findingFields": {
      "type": "object",
      "required": ["category", "severity", "title", "detail"],
      "properties": {
        "category": {"description": "One of `removed-api`, `deprecated-api`, `deprecated-api-in-use`, `eol-addon`, `eol-approaching`, `version-skew`, `chart-incompat`, `kb-stale`, `addon-no-data`, `unknown-api`, `crd-version`. A release may add categories within schemaVersion 1, so this is not an enum: treat one you do not know by its severity.", "type": "string"},
        "severity": {"enum": ["blocker", "warning", "info"]},
        "key": {"description": "Stable, count-free identity: category/discriminator. Baselines and notifications match on it.", "type": "string"},
        "title": {"type": "string"},
        "detail": {"type": "string"},
        "teams": {"type": "array", "items": {"type": "string"}},
        "namespaces": {"type": "array", "items": {"type": "string"}},
        "remediation": {"type": "string"},
        "citations": {"type": "array", "items": {"type": "string"}},
        "objects": {"type": "array", "maxItems": 100, "items": {"$ref": "#/$defs/objectRef"}},
        "objectsOmitted": {"description": "Affected objects not listed.", "type": "integer", "minimum": 1},
        "baselineState": {"description": "With --baseline: unchanged (the baseline had it) or new.", "enum": ["new", "unchanged"]}
      }
    },
    "finding": {"$ref": "#/$defs/findingFields"},
    "suppressed": {
      "allOf": [{"$ref": "#/$defs/findingFields"}],
      "required": ["reason", "source"],
      "properties": {
        "reason": {"type": "string"},
        "source": {"description": "What suppressed it: the config file, annotation, or spec.ignore.", "type": "string"},
        "expires": {"description": "YYYY-MM-DD, as the rule gave it.", "type": "string"}
      }
    },
    "objectRef": {
      "type": "object",
      "properties": {
        "namespace": {"type": "string"},
        "name": {"type": "string"},
        "file": {"description": "Manifest path, slash-separated, relative to filesBase.", "type": "string"},
        "line": {"description": "1-based line of the object's apiVersion key.", "type": "integer", "minimum": 1},
        "renderedFrom": {"description": "The Helm template the object was rendered from (# Source: comment).", "type": "string"},
        "manager": {"description": "Live objects: the field manager that wrote it through the flagged API, or kubectl last-applied.", "type": "string"},
        "ignore": {"type": "string"},
        "ignoreReason": {"type": "string"}
      }
    },
    "gap": {
      "type": "object",
      "required": ["capability", "reason"],
      "properties": {
        "capability": {"type": "string"},
        "reason": {"type": "string"},
        "partial": {"type": "boolean"},
        "skipped": {"type": "array", "items": {"type": "string"}},
        "required": {"description": "The gap makes the verdict unknown.", "type": "boolean"}
      }
    },
    "hop": {
      "type": "object",
      "required": ["from", "to", "score", "verdict", "findings"],
      "properties": {
        "from": {"$ref": "#/$defs/minor"},
        "to": {"description": "The minor the control plane reaches at this hop; the cluster as it is, judged at it.", "$ref": "#/$defs/minor"},
        "score": {"description": "The score at this hop's to.", "type": "integer", "minimum": 0, "maximum": 100},
        "verdict": {"description": "The verdict at this hop's to, counting new and referenced findings.", "enum": ["ready", "blocked", "unknown"]},
        "findings": {"description": "Findings first seen at this hop, in full.", "type": "array", "items": {"$ref": "#/$defs/finding"}},
        "changed": {"description": "Findings listed at an earlier hop whose severity differs from the last earlier hop that had them.", "type": "array", "items": {"$ref": "#/$defs/findingRef"}},
        "carried": {"description": "Findings listed at an earlier hop, at the same severity.", "type": "array", "items": {"$ref": "#/$defs/findingRef"}},
        "notAssessed": {"description": "Every gap at this hop's to.", "type": "array", "items": {"$ref": "#/$defs/gap"}}
      }
    },
    "findingRef": {
      "type": "object",
      "required": ["key", "severity", "title", "since"],
      "properties": {
        "key": {"type": "string"},
        "severity": {"description": "At this hop.", "enum": ["blocker", "warning", "info"]},
        "was": {"description": "changed only: the severity at the last earlier hop that had the finding.", "enum": ["blocker", "warning", "info"]},
        "title": {"description": "At this hop.", "type": "string"},
        "since": {"description": "The to of the hop that lists the finding in full.", "$ref": "#/$defs/minor"}
      }
    },
    "teamScore": {
      "type": "object",
      "required": ["score", "ready", "blockers", "warnings"],
      "properties": {
        "score": {"type": "integer"},
        "ready": {"description": "No blocker among this team's findings. It counts only the team's findings: the cluster's not-assessed gaps and unattributed blockers do not lower it, so gate on the report's verdict, not on a team's ready.", "type": "boolean"},
        "blockers": {"type": "integer"},
        "warnings": {"type": "integer"}
      }
    }
  }
}
